### ISSUE TITLE
org.pcap4j.core.PcapNativeException: unknown file format

### ISSUE THREAD

**Issue by ouyangkongtong** [kaitoy/pcap4j#114]
hi @kaitoy ,

   1、I use tcpdump to grab the message and save it（file name:  test.pcap）
   2、I use pcap to read the file，but exception：org.pcap4j.core.PcapNativeException: unknown file format
 
ps:
read file code：
`PcapHandle handle = Pcaps.openOffline("test.pcap");`
environment:  mac osx

**Comment by kaitoy** [comment]
Please tell me the exact command you ran to make the test.pcap.

**Comment by ouyangkongtong** [comment]
exact command : sudo tcpdump tcp port 1521 -s 0 -X -A > test.pcap

content:

> 14:02:44.202345 IP 30.5.52.39.65217 > 10.101.106.170.ncube-lm: Flags [S], seq 1319402277, win 65535, options [mss 1460,nop,wscale 5,nop,nop,TS val 1349877646 ecr 0,sackOK,eol], length 0
	0x0000:  5869 6c5f 513e 1865 90d6 05ef 0800 4500  Xil_Q>.e......E.
	0x0010:  0040 df8a 4000 4006 93f2 1e05 3427 0a65  .@..@.@.....4'.e
	0x0020:  6aaa fec1 05f1 4ea4 7b25 0000 0000 b002  j.....N.{%......
	0x0030:  ffff d141 0000 0204 05b4 0103 0305 0101  ...A............
	0x0040:  080a 5075 7f8e 0000 0000 0402 0000       ..Pu..........
14:02:44.208178 IP 10.101.106.170.ncube-lm > 30.5.52.39.65217: Flags [S.], seq 3746049117, ack 1319402278, win 28960, options [mss 1460,sackOK,TS val 3030028063 ecr 1349877646,nop,wscale 7], length 0
	0x0000:  1865 90d6 05ef 5869 6c5f 513e 0800 4500  .e....Xil_Q>..E.
	0x0010:  003c 0000 4000 3806 7b81 0a65 6aaa 1e05  .<..@.8.{..ej...
	0x0020:  3427 05f1 fec1 df48 2c5d 4ea4 7b26 a012  4'.....H,]N.{&..
	0x0030:  7120 21b3 0000 0204 05b4 0402 080a b49a  q.!.............
	0x0040:  8f1f 5075 7f8e 0103 0307                 ..Pu......
14:02:44.208232 IP 30.5.52.39.65217 > 10.101.106.170.ncube-lm: Flags [.], ack 1, win 4117, options [nop,nop,TS val 1349877651 ecr 3030028063], length 0
	0x0000:  5869 6c5f 513e 1865 90d6 05ef 0800 4500  Xil_Q>.e......E.
	0x0010:  0034 b7bc 4000 4006 bbcc 1e05 3427 0a65  .4..@.@.....4'.e
	0x0020:  6aaa fec1 05f1 4ea4 7b26 df48 2c5e 8010  j.....N.{&.H,^..
	0x0030:  1015 b185 0000 0101 080a 5075 7f93 b49a  ..........Pu....
	0x0040:  8f1f                                     ..

>

**Comment by kaitoy** [comment]
I's not a correct way to make a pcap file using tcpdump.
Please use `-w` option.
