### ISSUE TITLE
How parse the packet after get from pcap file by getNextPacketEx

### ISSUE THREAD

**Issue by cetsupport** [kaitoy/pcap4j#67]
By refer to ReadPacketFile example, we know that it's easy to get whole packet from PcapHandle. Can we do decode the packet content layer by layer?

For example: Ethernet II->Dot1QVlanTang->IPV6->TCP....

Thank you very much.

**Comment by kaitoy** [comment]
You can get a byte array instead of a Packet instance by PcapHandle.getNextRawPacketEx().
Then, pass the byte array to EthernetPacket.newPacket() without a packet factory module in your class path, which returns an EthernetPacket instance with an UnknownPacket instance in its payload field.
Then, get the byte array from the UnknownPacket (e.g. etherPacket.getPayload().getRawData()) and pass it to Dot1qVlanTagPacket.newPacket() without a packet factory module in your class path, which returns a Dot1qVlanTagPacket instance with an UnknownPacket instance in its payload field, and so forth.
Does this what you want to do?

**Comment by cetsupport** [comment]
Thanks Kaitoy for your clarification, Yes, that's what I'm doing.

From the page: https://github.com/kaitoy/pcap4j/blob/v1/www/Packet.md, I have tried packet.get(IpV4Packet.class) but it doesn't work and return error. So I guess the PCAP4j it self not able to decode the packet by default. With your explanation, I understood must decode manually layer by layer.

But when we use the pcaket.get() can return next layer packet instead of unknowpacket? Is that when we build a packet for sending out?

**Comment by kaitoy** [comment]
You need to include a packet factory module (i.e. pcap4j-packetfactory-static.jar or pcap4j-packetfactory-propertiesbased.jar) in your class path to decode packets.
With a packet factory module, I think pcap4j will work for you as you want.

**Comment by cetsupport** [comment]
Thanks, I will try it.

**Comment by cetsupport** [comment]
Hi, Kaitory:

I tried your suggestion. It's works perfectly!

Thank you very much!

**Comment by kaitoy** [comment]
It's OK.

**Comment by venk3193** [comment]
Hi Kaitoy,
From a packet byte stream, I can see how one would get the EthernetPacket from your response on Jul 2.  I need to know whether the packet is a TCP or UDP packet.  Also, need to get the layer-7 protocol of the packet.  Is there any pointer or code you could point me to?
thanks,
VC

**Comment by kaitoy** [comment]
packet.get(TcpPacket.class) returns a TcpPacket object if it includes a TCP packet, otherwise null is returned. The same happens on packet.get(UdpPacket.class).
You can find ports in TcpPacket or UdpPacket which indicate the application layer protocol.

**Comment by venk3193** [comment]
Thanks a lot for the quick response!  Very helpful.
I tried to get the IpPacket (to get the IP addresses) using IpPacket.newPacket(etherPacket.getPayload().getRawData()).  It gave me a Packet object, but no IP header (null).  Why did that not work?
Thanks a lot for the quick response!  Very helpful.  One last question...
I tried to get the IpPacket (to get the IP addresses) using IpPacket.newPacket(etherPacket.getPayload().getRawData()).  It gave me a Packet object, but no IP header (null).  Why did that not work?

**Comment by kaitoy** [comment]
`IpPacket#newPacket` uses a packet factory to get a class representing IPv4 packet or IPv6 packet.
So, if a packet factory is not in your class path `IpPacket#newPacket` always returns an UnknownPacket object.

**Comment by erjaimin** [comment]
Hi Kaitoy,

I am trying to extract DNS information (query and response) from pcap file using pcap4j. I managed to extract EthernetPacket and to filter only UdpPackets. From UDPPacket I got the UdpHeader and the payload which gives me UnknownPacket. I think the DNS info resides in the UnknownPacket raw data. I am not able decode this raw data in user readable string. Please help me out.

**Comment by kaitoy** [comment]
Now Pcap4J doesn't support DNS protocol.
So you need to write one or more  packet classes to dissect DNS messages as per [RFC 1035](https://tools.ietf.org/html/rfc1035)

**Comment by erjaimin** [comment]
Could you suggest me any other library which supports DNS protocol?

**Comment by kaitoy** [comment]
I don't know. jpcap or jNetPcap?

**Comment by erjaimin** [comment]
I want to stay with pcap4j. Could you please give me some pointers about which classes I need to create and so forth. Any help would be appreciated.

**Comment by kaitoy** [comment]
Sure.
The [commit 6a96551a6645491399365e3f2256183058542ff8](https://github.com/kaitoy/pcap4j/commit/6a96551a6645491399365e3f2256183058542ff8) which added SCTP support would be a good example to refer to when you write DNS support.
And, I can write some skeletal code for you hopefully by the end of this year.

**Comment by erjaimin** [comment]
Thanks you. Please do it at your earliest convenience. I'm not bale to decode the UDPPacket payload.

**Comment by kaitoy** [comment]
I've implemented complete DNS support.
Please try the snapshot build: https://oss.sonatype.org/content/repositories/snapshots/org/pcap4j/pcap4j-distribution/1.7.1-SNAPSHOT/pcap4j-distribution-1.7.1-20161230.211659-7-bin.zip

**Comment by venk3193** [comment]
Hi Kaito - A couple of questions..
1. I am parsing HL7 packets.  They are all TCP IPV4 packets.  I can see that in Wireshark. I need to get the Mac addresses, IP addresses, Ports etc from the packets.  I am using a roundabout inefficient method of doing that in my current PoC - I create EthernetPacket to get Mac addresses, TcpPackets to get Port information.  I however, *cannot* get the IP address - I tried IpV4.newPacket(..), I tried packet.get(TcpPacket.class) etc.  No luck.  How should I get all my packet information easily?

2. This is a bigger issue.  I see that the Hex data that I see on Wireshark is not being accurately picked up by the pcap4j adapter. I'm sure I am making a mistake somewhere.  Please advise.  Here is what Wireshark shows in my pcap file (first few bytes): "00 50 56 a6 0e 88...".
Here is what I get "0, 80, 86, -90, 14, -120..".  How does a6 get represented as -90.  88 get represented as -120?  Because of this conversion, I am getting incorrect Port numbers and Macs.

**Comment by kaitoy** [comment]
For #1, `packet.get(IpV4Packet.class).getHeader().getSrcAddr()` should work.

For #2, you can use `ByteArrays.toHexString()` to convert a byte array to hex. (e.g. `ByteArrays.toHexString(packet.getRawData(), " ")`).
You can get an unsigned port number by `TcpPort.valueAsInt()` (e.g. `packet.get(TcpPacket.class).getHeader().getSrcPort().valueAsInt()`), and a mac address by `packet.get(EthernetPacket.class).getHeader().getSrcAddr().toString()`).

**Comment by venk3193** [comment]
Thanks Kaito.  I have not tried out #2 yet.  Here is my outcome with #1.

 For #1: I tried "packet.get(IpV4Packet.class)".  I had tried this earlier too.  I get a "null" value.  I look at the data in Wireshark - it gives me the "Internet Protocol Version 4, Src: ..., Dst: ..." header.  I am not manipulating the data in any way before making this call.
My code is the following... "pkt" is null after execution.:
        Packet pkt;
		try {
			//ip = packet.get(IpV4Packet.class);
            unknownPacket = UnknownPacket.newPacket(packetData, 0, packetData.length);
            pkt = unknownPacket.get(IpV4Packet.class);
....

**Comment by venk3193** [comment]
I tried the following too.  Here too pkt is coming out as null.

		//byte[] ba = handle.getNextRawPacketEx();
		handle = Pcaps.openOffline(PCAP_FILE, TimestampPrecision.NANO);
		Packet packet = handle.getNextPacket();
		IpV4Packet pkt = packet.get(IpV4Packet.class);
		return pkt;

**Comment by venk3193** [comment]
About the 2nd part of #2, thats how I have coded it.  I am getting incorrect mac and port numbers.
My code:
tcpPacket.getHeader().getDstPort().valueAsInt()
ep.getHeader().getDstAddr().toString()

**Comment by venk3193** [comment]
I get incorrect values with the above code.  After my debugging, I think it may be something internally in the conversion of the byte data into EthernetPacket and to TcpPacket.  Or am I doing something wrong?  Could you kindly check please?

**Comment by kaitoy** [comment]
You need to add a packet factory (e.g. pcap4j-packetfactory-static.jar) to your class path for packet dissection.

**Comment by venk3193** [comment]
I added pcap4j-packetfactory-static.jar to the classpath and to double check I printed out my classpath:
10:23:26.042 [main] DEBUG c.s.m.SSMain - Running main...
/home/iot/workspace/ss/lib/pcap4j-packetfactory-static-1.6.3.jar
/home/iot/workspace/ss/classes/
/home/iot/workspace/ss/bin/
etc.

The above issues are *not* going away.  I debugged the code and I see that the code is still executing this line of code:
public static StaticUnknownPacketFactory getInstance() { return INSTANCE; }

Is that correct?  What is expected to happen if I have added "pcap4j-packetfactory-static-1.6.3.jar" to my classpath?

My issues continue to be the following:
1. The IPv4 packet is not being recognized and I get "pkt" to be null on this call: 
IpV4Packet pkt = packet.get(IpV4Packet.class);
2. My port numbers are coming out incorrect when I called TcpPacket.newPacket(..).  In this case, I am passing in the entire packet byte array (the entire frame as such) to the TcpPacket.newPacket(..) call.  Is that ok?

I'm sorry to bother you with these questions again... just that I've been blocked by this and unfortunately not been able to figure out what I am doing wrong.

**Comment by kaitoy** [comment]
Where did the `packet` of `IpV4Packet pkt = packet.get(IpV4Packet.class);` come from?

**Comment by venk3193** [comment]
I get the packets from a pcap file.
Here is one of the packets from Wireshark:
Frame 4: 60 bytes on wire (480 bits), 60 bytes captured (480 bits) on interface 0
Ethernet II, Src: Vmware_a6:0e:88 (00:50:56:a6:0e:88), Dst: Vmware_a6:4a:86 (00:50:56:a6:4a:86)
Internet Protocol Version 4, Src: 10.227.83.250, Dst: 10.227.83.249
Transmission Control Protocol, Src Port: 2550, Dst Port: 24159, Seq: 1, Ack: 3235, Len: 0

Here is my test code that is trying to create an IpV4Packet. 
handle = Pcaps.openOffline(PCAP_FILE, TimestampPrecision.NANO);
Packet packet = handle.getNextPacket();
IpV4Packet pkt = packet.get(IpV4Packet.class);
return pkt;

**Comment by kaitoy** [comment]
Did you try `System.out.println(packet);`? What do you see if you do it?

**Comment by venk3193** [comment]
Here is what I get with that call:

[data (60 bytes)]
  Hex stream: 00 50 56 a6 4a 86 00 50 56 a6 0e 88 08 00 45 00 00 28 60 3a 40 00 40 06 1c dd 0a e3 53 fa 0a e3 53 f9 09 f6 5e 5f 7e ce 91 3b 33 a1 2b 33 50 10 01 00 19 e8 00 00 00 00 00 00 00 00

**Comment by venk3193** [comment]
BTW - on the port issue, I was able to get past that problem after I picked all bytes starting with byte # 34.  In other words I used the following call:
TcpPacket.newPacket(packetData, 34, packetData.length-34);  --> I get correct port numbers

versus:
TcpPacket.newPacket(packetData, 0, packetData.length); --> I get incorrect port numbers

**Comment by kaitoy** [comment]
How about `System.out.println(handle);`?

**Comment by venk3193** [comment]
here is the handle info
Link type: [1 (Ethernet)] handle: [native@0x7ff3403de350] Open: [true] Filtering Expression: []

**Comment by venk3193** [comment]
Some more information:
The IllegalArgumentException is thrown by SimplePacketFactoryBinder when the following if-condition is not met:

    if (Packet.class.isAssignableFrom(targetClass)) {
      return (PacketFactory<T, N>)StaticUnknownPacketFactory.getInstance();
    } else {
      StringBuilder sb = new StringBuilder(100);
      sb.append("targetClass: ").append(targetClass)
        .append(" numberClass: ").append(numberClass);
      throw new IllegalArgumentException(sb.toString());
    }

In the above case, targetClass = org.pcap4j.packet.IpV4Packet$IpV4Tos.

This call is deeply nested and I'm not sure how I can control what the targetClass needs to be.  Also, IpV4Tos is a standalone interface nested within IpV4Packet class.  What is the purpose of this check?

**Comment by kaitoy** [comment]
The error is indicating no packet factory is properly added to your classpath.
Please explain what you did as detail as possible.

**Comment by venk3193** [comment]
I've been using Eclipse for many years now.  Here are the details:
I have pcap4j-core-1.6.7.jar and pcap4j-packetfactory-static-1.6.3.jar in my project classpath. And I think it was picking up both the jars.  That did not seem to change anything, so, based on your documentation I also added it to the User Entries of the Run Configuration.
"in Eclipse, add pcap4j-packetfactory-static or pcap4j-packetfactory-propertiesbased project to the top of User Entries in Classpath tab of the Run Configuration for the sample."
I printed out the classpath entries (Pl. see above comment) and the packetfactory-static is in the classpath:
10:23:26.042 [main] DEBUG c.s.m.SSMain - Running main...
/home/iot/workspace/ss/lib/pcap4j-packetfactory-static-1.6.3.jar
/home/iot/workspace/ss/classes/
/home/iot/workspace/ss/bin/
etc.

**Comment by kaitoy** [comment]
Is `pcap4j-core-1.6.7.jar` a typo? There isn't such version released.

**Comment by venk3193** [comment]
Sorry: pcap4j-core-1.6.7-SNAPSHOT.jar

I think I picked it up from my .m2 folder

**Comment by venk3193** [comment]
I meant to say in my target folder:
....
[INFO] 
[INFO] --- maven-jar-plugin:2.4:jar (default-jar) @ pcap4j-core ---
[INFO] Building jar: /home/iot/Downloads/pcap4j/pcap4j-core/target/pcap4j-core-1.6.7-SNAPSHOT.jar
[INFO] ------------------------------------------------------------------------
[INFO] BUILD SUCCESS

**Comment by venk3193** [comment]
Kaito, thanks for asking me that question about the version.
I decided to try one of your released version from git - so I downloaded 1.7.0.
I added the core-1.7.0 and packetfactory-1.7.0 to my classpath (I removed the 1.6.* versions).  That fixed the problem.  IpV4Packet is recognized.  Everything works.
I just lost a lot of time with some version conflict.  Thanks for helping out.

**Comment by KuldeepBhardwaj** [comment]
Hi Kaito,
I am new to pcap4j and I need to get the http url from the packet. Any pointer from you would be helpful to me.
Thanks,Kuldeep

**Comment by kaitoy** [comment]
I've never parsed HTTP, and I have no idea.

**Comment by jagadeeshkoka** [comment]
@kaitoy  sorry for asking on the closed thread, do you have any complete example to parse pacap packet, I mean, I can parse now too but all I get is `byte[]`  what I need is readable and able to store in DB format.

**Comment by kaitoy** [comment]
Please refer to [Pcap4J homepage](https://www.pcap4j.org/). Notice that you need to add a packet factory module to your class path.

**Comment by MeesalaSowmya** [comment]
how to get non printable chars printed in console same as pcap file ?
